{
  "schemaVersion": "jlink-mcp.pro-review/v1",
  "phaseId": "P00",
  "decision": "correction_required",
  "baselineConsistency": "insufficient_evidence",
  "requirementsReviewed": [
    "REQ-GEN-001",
    "REQ-GEN-002",
    "REQ-GEN-003",
    "REQ-GEN-004",
    "REQ-GEN-005",
    "REQ-ROLE-001",
    "REQ-ROLE-002",
    "REQ-ROLE-003",
    "REQ-PATH-001",
    "REQ-PATH-002",
    "REQ-PATH-003",
    "REQ-PATH-004",
    "REQ-PATH-005",
    "REQ-PATH-006",
    "REQ-PATH-007",
    "REQ-ART-001",
    "REQ-ART-002",
    "REQ-ART-003",
    "REQ-ART-004",
    "REQ-ART-005",
    "REQ-ART-006",
    "REQ-ART-007",
    "REQ-VREAD-001",
    "REQ-VREAD-002",
    "REQ-VREAD-003",
    "REQ-VREAD-004",
    "REQ-VREAD-005",
    "REQ-VREAD-006",
    "REQ-VREAD-007",
    "REQ-VWRITE-001",
    "REQ-VWRITE-002",
    "REQ-VWRITE-003",
    "REQ-VWRITE-004",
    "REQ-VWRITE-005",
    "REQ-VWRITE-006",
    "REQ-VWRITE-007",
    "REQ-VWRITE-008",
    "REQ-VWRITE-009",
    "REQ-RISK-001",
    "REQ-RISK-002",
    "REQ-RISK-003",
    "REQ-RISK-004",
    "REQ-RISK-005",
    "REQ-RISK-006",
    "REQ-RISK-007",
    "REQ-RISK-008",
    "REQ-POL-001",
    "REQ-POL-002",
    "REQ-POL-003",
    "REQ-POL-004",
    "REQ-POL-005",
    "REQ-DRY-001",
    "REQ-DRY-002",
    "REQ-JLINK-001",
    "REQ-JLINK-002",
    "REQ-JLINK-003",
    "REQ-JLINK-004",
    "REQ-JLINK-005",
    "REQ-HSS-001",
    "REQ-HSS-002",
    "REQ-HSS-003",
    "REQ-HSS-004",
    "REQ-HSS-005",
    "REQ-HSS-006",
    "REQ-HSS-007",
    "REQ-HSS-008",
    "REQ-HSSW-001",
    "REQ-HSSW-002",
    "REQ-HSSW-003",
    "REQ-HSSW-004",
    "REQ-HSSW-005",
    "REQ-HSSW-006",
    "REQ-HSSW-007",
    "REQ-HSSW-008",
    "REQ-HSSW-009",
    "REQ-HSSW-010",
    "REQ-BMA-001",
    "REQ-BMA-002",
    "REQ-BMA-003",
    "REQ-BMA-004",
    "REQ-RSP-001",
    "REQ-RSP-002",
    "REQ-RSP-003",
    "REQ-RTT-001",
    "REQ-RTT-002",
    "REQ-RTT-003",
    "REQ-RTT-004",
    "REQ-SVD-001",
    "REQ-SVD-002",
    "REQ-SVD-003",
    "REQ-SVD-004",
    "REQ-SVD-005",
    "REQ-SVD-006",
    "REQ-SVD-007",
    "REQ-SVD-008",
    "REQ-FLASH-001",
    "REQ-FLASH-002",
    "REQ-FLASH-003",
    "REQ-FLASH-004",
    "REQ-CPU-001",
    "REQ-CPU-002",
    "REQ-CPU-003",
    "REQ-CPU-004",
    "REQ-CPU-005",
    "REQ-RAW-001",
    "REQ-RAW-002",
    "REQ-RAW-003",
    "REQ-RAW-004",
    "REQ-CAP-001",
    "REQ-CAP-002",
    "REQ-CAP-003",
    "REQ-CAP-004",
    "REQ-CAP-005",
    "REQ-CAP-006",
    "REQ-CAP-007",
    "REQ-SEG-001",
    "REQ-SEG-002",
    "REQ-AUD-001",
    "REQ-AUD-002",
    "REQ-AUD-003",
    "REQ-AUD-004",
    "REQ-SES-001",
    "REQ-SES-002",
    "REQ-SES-003",
    "REQ-SES-004",
    "REQ-DISC-001",
    "REQ-DISC-002",
    "REQ-DISC-003",
    "REQ-DISC-004",
    "REQ-ENV-001",
    "REQ-ENV-002",
    "REQ-ENV-003",
    "REQ-OOS-001",
    "REQ-OOS-002",
    "REQ-OOS-003",
    "REQ-OOS-004",
    "REQ-OOS-005",
    "REQ-OOS-006",
    "REQ-OOS-007",
    "REQ-OOS-008",
    "REQ-CLR-001",
    "REQ-CLR-002",
    "REQ-CLR-003",
    "REQ-CLR-004"
  ],
  "findings": [],
  "testAssessment": {
    "status": "insufficient_evidence",
    "notes": [
      "Template only"
    ]
  },
  "hardwareAssessment": {
    "status": "insufficient_evidence",
    "notes": [
      "Template only"
    ]
  },
  "timingCorrection": {
    "plannedMinutes": 180,
    "actualExecutionMinutes": 0,
    "comparableRatios": [],
    "recommendedMultiplier": 1.0,
    "nextPhaseBudgetMinutes": 300,
    "rationale": "Replace with evidence-based calculation after P00."
  },
  "corrections": [
    "Replace all template placeholders with observed evidence."
  ],
  "acceptedEvidence": [],
  "unresolvedRisks": [
    "P00 has not run."
  ]
}
